{
  "$schema": "https://json-schema.org/draft/2020-12/schema",
  "$id": "https://argus.local/contracts/events/m01/machine.telemetry.received.v1.json",
  "$comment": "GENERATED from m01_twin models by scripts/contracts.py export. Do not hand-edit.",
  "properties": {
    "machine_id": {
      "title": "Machine Id",
      "type": "string"
    },
    "ts": {
      "format": "date-time",
      "title": "Ts",
      "type": "string"
    },
    "engine_hours": {
      "minimum": 0,
      "title": "Engine Hours",
      "type": "number"
    },
    "fuel_pct": {
      "maximum": 100,
      "minimum": 0,
      "title": "Fuel Pct",
      "type": "number"
    },
    "fuel_rate_lph": {
      "minimum": 0,
      "title": "Fuel Rate Lph",
      "type": "number"
    },
    "load_cycles": {
      "description": "Cumulative load-cycle counter",
      "minimum": 0,
      "title": "Load Cycles",
      "type": "integer"
    },
    "idle_seconds": {
      "description": "Cumulative idle seconds counter",
      "minimum": 0,
      "title": "Idle Seconds",
      "type": "number"
    },
    "speed_kmh": {
      "minimum": 0,
      "title": "Speed Kmh",
      "type": "number"
    },
    "rpm": {
      "minimum": 0,
      "title": "Rpm",
      "type": "number"
    },
    "temperature_c": {
      "title": "Temperature C",
      "type": "number"
    },
    "lat": {
      "maximum": 90,
      "minimum": -90,
      "title": "Lat",
      "type": "number"
    },
    "lon": {
      "maximum": 180,
      "minimum": -180,
      "title": "Lon",
      "type": "number"
    },
    "operating_mode": {
      "enum": [
        "DIGGING",
        "SWINGING",
        "DUMPING",
        "LOADING",
        "HAULING",
        "RETURNING",
        "TRAVELLING",
        "IDLE",
        "OFF"
      ],
      "title": "Operating Mode",
      "type": "string"
    },
    "seatbelt": {
      "title": "Seatbelt",
      "type": "boolean"
    },
    "site_id": {
      "title": "Site Id",
      "type": "string"
    }
  },
  "required": [
    "machine_id",
    "ts",
    "engine_hours",
    "fuel_pct",
    "fuel_rate_lph",
    "load_cycles",
    "idle_seconds",
    "speed_kmh",
    "rpm",
    "temperature_c",
    "lat",
    "lon",
    "operating_mode",
    "seatbelt",
    "site_id"
  ],
  "title": "TelemetryReceivedPayload",
  "type": "object",
  "description": "Payload of 'machine.telemetry.received' (producer M01). "
}
